Morgan Stanley,ETV,Eaton Vance Tax-Managed Buy-Write Opportunities Fund,4,Below Average,,4.0,37.0,37.0,37.0,41.3,37.9,15.1
iShares,SMMV,iShares MSCI USA Small-Cap Min Vol Factor ETF,4,Low,Silver,4.0,37.0,37.0,37.0,37.0,37.0,84.0
BlackRock,FCOM,Fidelity MSCI Communication Services Index ETF,4,Average,Neutral,2.0,36.9,36.9,41.5,41.9,34.2,60.0
Invesco,CGW,Invesco S&P Global Water Index ETF,4,Low,Silver,2.0,36.8,36.8,36.8,34.7,53.3,46.3
State Street,HEDG,Equable Shares Hedged Equity ETF,4,Below Average,,3.0,36.3,36.3,36.3,54.2,39.2,66.6
First Trust,FRI,First Trust S&P REIT Index Fund,4,Average,Neutral,3.0,36.0,36.0,36.0,36.0,36.0,44.9
JPMorgan,JMEE,JPMorgan Small & Mid Cap Enhanced Equity ETF,4,Below Average,Bronze,4.0,35.8,35.8,35.8,35.8,34.4,58.9
Invesco,XMLV,Invesco S&P MidCap Low Volatility ETF,4,Low,Neutral,5.0,35.5,35.5,35.5,35.5,35.5,28.9
Invesco,GSY,Invesco Ultra Short Duration ETF,4,Average,Bronze,3.0,34.3,34.3,28.3,10.3,7.1,16.3
BlackRock,MIY,"BlackRock MuniYield Michigan Quality Fund, Inc.",4,Average,,,33.7,33.7,33.7,33.7,33.7,63.4
iShares,ILCV,iShares Morningstar Value ETF,4,Below Average,Gold,3.0,33.6,33.6,33.6,33.6,38.8,23.5
iShares,AOM,iShares Core 40/60 Moderate Allocation ETF,4,Average,Gold,3.0,33.2,33.2,33.2,30.1,16.2,6.3
J.P. Morgan,MSD,MS Emerging Markets Debt Fund,4,Below Average,,,31.7,31.7,30.0,13.9,13.5,4.1
iShares,EMHY,iShares J.P. Morgan EM High Yield Bond ETF,4,Average,,2.0,31.4,31.4,31.4,42.4,33.8,62.7
Vanguard,VCR,Vanguard Consumer Discretionary Index Fund ETF Shares,4,Average,Gold,3.0,31.2,31.2,31.2,30.3,37.7,63.8
Invesco,VVR,Invesco Senior Income Trust,4,Below Average,,,30.8,30.8,45.6,44.4,16.9,8.7
Invesco,RSPN,Invesco S&P 500® Equal Weight Industrials ETF,4,Below Average,Gold,3.0,29.4,29.4,29.4,29.8,11.9,45.5
JPMorgan,JPRE,JPMorgan Realty Income ETF,4,Below Average,Gold,3.0,29.4,29.4,29.4,29.4,29.4,29.4
First Trust,LALT,First Trust Multi-Strategy Alternative ETF,4,Average,,4.0,29.3,29.3,29.3,29.3,29.3,60.4
First Trust,WCMI,First Trust WCM International Equity ETF,4,Below Average,Neutral,3.0,28.6,28.6,28.6,65.9,37.8,100.0
iShares,HSCZ,iShares Currency Hedged MSCI EAFE Small-Cap ETF,5,Low,Bronze,3.0,28.6,28.6,28.6,28.6,28.6,17.1
JPMorgan,JPME,JPMorgan Diversified Return U.S. Mid Cap Equity ETF,4,Below Average,Gold,3.0,27.1,27.1,27.1,27.1,27.1,27.1
Invesco,RWL,Invesco S&P 500 Revenue ETF,5,Average,Silver,3.0,27.0,27.0,23.3,45.7,16.1,30.2
Vanguard,VOX,Vanguard Communication Services Index Fund ETF Shares,4,Average,Neutral,2.0,23.0,23.0,16.6,9.0,4.8,1.0
First Trust,FIW,First Trust Water ETF,4,Below Average,Neutral,5.0,21.6,21.6,21.6,21.9,61.7,96.1
BlackRock,MUA,BlackRock MuniAssets Fund,4,Average,,,20.9,20.9,20.9,20.9,20.6,15.3
Invesco,XMVM,Invesco S&P MidCap Value with Momentum ETF,5,Average,Silver,4.0,19.3,19.3,19.3,19.3,18.6,3.6
Invesco,IDHQ,Invesco S&P International Developed Quality ETF,4,Below Average,Silver,4.0,14.0,14.0,14.0,14.0,13.0,59.9
Morgan Stanley,XAGG,Eaton Vance Income Opportunities ETF,4,Below Average,Neutral,,13.7,13.7,12.1,39.8,44.5,46.7
First Trust,FMNY,First Trust New York High Income Municipal ETF,4,Low,Neutral,,10.1,10.1,10.1,10.1,10.1,10.1
First Trust,MMSC,First Trust Multi-Manager Small Cap Opportunities ETF,5,Average,Neutral,2.0,0.0,0.0,0.0,0.0,0.0,0.0
SPDR,SMLV,State Street® SPDR® US Small Cap Low Volatility Index ETF,4,Below Average,Neutral,2.0,0.0,0.0,0.0,0.0,0.0,0.0
Invesco,IROC,Invesco Rochester High Yield Municipal ETF,4,Below Average,Neutral,,0.0,0.0,0.0,0.0,0.0,0.0
First Trust,DDIV,First Trust Dorsey Wright Momentum & Dividend ETF,4,Average,Bronze,4.0,0.0,0.0,0.0,0.0,0.0,0.0
